{"app_id":"bears-app-based-workflow","build_ref":"BUILD-6F1756B4E064B2DC80B9C79C","edges":[{"active":true,"condition_refs":[],"from_ref":"DEC-ASSESSMENT-SEPARATION","kind":"defines","ref":"EDGE-DEC-ASSESSMENT-SEPARATION-REQ-EFFECTIVENESS-BOUNDARY","source_refs":["docs/app-functional-map.v4.json","docs/workflow-refactor-v5-assessment.md","waves/workflow-refactor-v5/spec.md"],"to_ref":"REQ-EFFECTIVENESS-BOUNDARY"},{"active":true,"condition_refs":[],"from_ref":"DEC-OWNERSHIP-MODEL","kind":"defines","ref":"EDGE-DEC-OWNERSHIP-MODEL-REQ-DIRECT-OWNERSHIP","source_refs":["docs/app-functional-map.v4.json","waves/workflow-refactor-v5/spec.md"],"to_ref":"REQ-DIRECT-OWNERSHIP"},{"active":true,"condition_refs":[],"from_ref":"DEC-OWNERSHIP-MODEL","kind":"defines","ref":"EDGE-DEC-OWNERSHIP-MODEL-REQ-JOURNAL-OWNERSHIP","source_refs":["docs/app-functional-map.v4.json","waves/workflow-refactor-v5/spec.md"],"to_ref":"REQ-JOURNAL-OWNERSHIP"},{"active":true,"condition_refs":[],"from_ref":"DEC-OWNERSHIP-MODEL","kind":"defines","ref":"EDGE-DEC-OWNERSHIP-MODEL-REQ-REPO-L2-OWNERSHIP","source_refs":["docs/app-functional-map.v4.json","waves/workflow-refactor-v5/spec.md"],"to_ref":"REQ-REPO-L2-OWNERSHIP"},{"active":true,"condition_refs":[],"from_ref":"DEC-OWNERSHIP-MODEL","kind":"defines","ref":"EDGE-DEC-OWNERSHIP-MODEL-REQ-SUBAGENT-DISPATCH","source_refs":["docs/app-functional-map.v4.json","waves/workflow-refactor-v5/spec.md"],"to_ref":"REQ-SUBAGENT-DISPATCH"},{"active":true,"condition_refs":[],"from_ref":"DEC-SEMANTIC-ANALYSIS","kind":"defines","ref":"EDGE-DEC-SEMANTIC-ANALYSIS-REQ-ANALYSIS-RESULT","source_refs":["docs/app-functional-map.v4.json","waves/workflow-refactor-v5/spec.md"],"to_ref":"REQ-ANALYSIS-RESULT"},{"active":true,"condition_refs":[],"from_ref":"DEC-SEMANTIC-ANALYSIS","kind":"defines","ref":"EDGE-DEC-SEMANTIC-ANALYSIS-REQ-ANALYSIS-SCOPE","source_refs":["docs/app-functional-map.v4.json","waves/workflow-refactor-v5/spec.md"],"to_ref":"REQ-ANALYSIS-SCOPE"},{"active":true,"condition_refs":[],"from_ref":"DEC-SEMANTIC-ANALYSIS","kind":"defines","ref":"EDGE-DEC-SEMANTIC-ANALYSIS-REQ-AUDITED-SEMANTICS","source_refs":["docs/app-functional-map.v4.json","waves/workflow-refactor-v5/spec.md"],"to_ref":"REQ-AUDITED-SEMANTICS"},{"active":true,"condition_refs":[],"from_ref":"DEC-SINGLE-ROUTE-REGISTRY","kind":"defines","ref":"EDGE-DEC-SINGLE-ROUTE-REGISTRY-REQ-ROUTE-REGISTRY","source_refs":["docs/app-functional-map.v4.json","waves/workflow-refactor-v5/spec.md"],"to_ref":"REQ-ROUTE-REGISTRY"},{"active":true,"condition_refs":[],"from_ref":"DEC-TYPED-DIMENSIONS","kind":"defines","ref":"EDGE-DEC-TYPED-DIMENSIONS-REQ-SEVEN-DIMENSIONS","source_refs":["docs/app-functional-map.v4.json","waves/workflow-refactor-v5/spec.md"],"to_ref":"REQ-SEVEN-DIMENSIONS"},{"active":true,"condition_refs":[],"from_ref":"FUNC-ANALYSIS-RESULT","kind":"depends_on","ref":"EDGE-DEP-FUNC-ANALYSIS-RESULT-FUNC-ANALYSIS-SCOPE","source_refs":["docs/app-functional-map.v4.json","waves/workflow-refactor-v5/spec.md"],"to_ref":"FUNC-ANALYSIS-SCOPE"},{"active":true,"condition_refs":[],"from_ref":"FUNC-ANALYSIS-SCOPE","kind":"depends_on","ref":"EDGE-DEP-FUNC-ANALYSIS-SCOPE-FUNC-JOURNAL-OWNERSHIP","source_refs":["docs/app-functional-map.v4.json","waves/workflow-refactor-v5/spec.md"],"to_ref":"FUNC-JOURNAL-OWNERSHIP"},{"active":true,"condition_refs":[],"from_ref":"FUNC-ANALYSIS-SCOPE","kind":"depends_on","ref":"EDGE-DEP-FUNC-ANALYSIS-SCOPE-FUNC-ROUTE-REGISTRY","source_refs":["docs/app-functional-map.v4.json","waves/workflow-refactor-v5/spec.md"],"to_ref":"FUNC-ROUTE-REGISTRY"},{"active":true,"condition_refs":[],"from_ref":"FUNC-ANALYSIS-SCOPE","kind":"depends_on","ref":"EDGE-DEP-FUNC-ANALYSIS-SCOPE-FUNC-SEVEN-DIMENSIONS","source_refs":["docs/app-functional-map.v4.json","waves/workflow-refactor-v5/spec.md"],"to_ref":"FUNC-SEVEN-DIMENSIONS"},{"active":true,"condition_refs":[],"from_ref":"FUNC-AUDITED-SEMANTICS","kind":"depends_on","ref":"EDGE-DEP-FUNC-AUDITED-SEMANTICS-FUNC-ANALYSIS-RESULT","source_refs":["docs/app-functional-map.v4.json","waves/workflow-refactor-v5/spec.md"],"to_ref":"FUNC-ANALYSIS-RESULT"},{"active":true,"condition_refs":[],"from_ref":"FUNC-EFFECTIVENESS-BOUNDARY","kind":"depends_on","ref":"EDGE-DEP-FUNC-EFFECTIVENESS-BOUNDARY-FUNC-ANALYSIS-RESULT","source_refs":["docs/app-functional-map.v4.json","docs/workflow-refactor-v5-assessment.md","waves/workflow-refactor-v5/spec.md"],"to_ref":"FUNC-ANALYSIS-RESULT"},{"active":true,"condition_refs":[],"from_ref":"FUNC-JOURNAL-OWNERSHIP","kind":"depends_on","ref":"EDGE-DEP-FUNC-JOURNAL-OWNERSHIP-FUNC-DIRECT-OWNERSHIP","source_refs":["docs/app-functional-map.v4.json","waves/workflow-refactor-v5/spec.md"],"to_ref":"FUNC-DIRECT-OWNERSHIP"},{"active":true,"condition_refs":[],"from_ref":"FUNC-JOURNAL-OWNERSHIP","kind":"depends_on","ref":"EDGE-DEP-FUNC-JOURNAL-OWNERSHIP-FUNC-REPO-L2-OWNERSHIP","source_refs":["docs/app-functional-map.v4.json","waves/workflow-refactor-v5/spec.md"],"to_ref":"FUNC-REPO-L2-OWNERSHIP"},{"active":true,"condition_refs":[],"from_ref":"FUNC-SUBAGENT-DISPATCH","kind":"depends_on","ref":"EDGE-DEP-FUNC-SUBAGENT-DISPATCH-FUNC-REPO-L2-OWNERSHIP","source_refs":["docs/app-functional-map.v4.json","waves/workflow-refactor-v5/spec.md"],"to_ref":"FUNC-REPO-L2-OWNERSHIP"},{"active":true,"condition_refs":[],"from_ref":"REQ-ANALYSIS-RESULT","kind":"defines","ref":"EDGE-REQ-ANALYSIS-RESULT-API","source_refs":["docs/app-functional-map.v4.json","waves/workflow-refactor-v5/spec.md"],"to_ref":"DIM-ANALYSIS-RESULT-API"},{"active":true,"condition_refs":[],"from_ref":"REQ-ANALYSIS-RESULT","kind":"defines","ref":"EDGE-REQ-ANALYSIS-RESULT-BEHAVIOR","source_refs":["docs/app-functional-map.v4.json","waves/workflow-refactor-v5/spec.md"],"to_ref":"DIM-ANALYSIS-RESULT-BEHAVIOR"},{"active":true,"condition_refs":[],"from_ref":"REQ-ANALYSIS-RESULT","kind":"defines","ref":"EDGE-REQ-ANALYSIS-RESULT-DATA","source_refs":["docs/app-functional-map.v4.json","waves/workflow-refactor-v5/spec.md"],"to_ref":"DIM-ANALYSIS-RESULT-DATA"},{"active":true,"condition_refs":[],"from_ref":"REQ-ANALYSIS-RESULT","kind":"defines","ref":"EDGE-REQ-ANALYSIS-RESULT-DEPENDENCY","source_refs":["docs/app-functional-map.v4.json","waves/workflow-refactor-v5/spec.md"],"to_ref":"DIM-ANALYSIS-RESULT-DEPENDENCY"},{"active":true,"condition_refs":[],"from_ref":"REQ-ANALYSIS-RESULT","kind":"defines","ref":"EDGE-REQ-ANALYSIS-RESULT-ERROR","source_refs":["docs/app-functional-map.v4.json","waves/workflow-refactor-v5/spec.md"],"to_ref":"DIM-ANALYSIS-RESULT-ERROR"},{"active":true,"condition_refs":[],"from_ref":"REQ-ANALYSIS-RESULT","kind":"decomposes_to","ref":"EDGE-REQ-ANALYSIS-RESULT-FUNC-ANALYSIS-RESULT","source_refs":["docs/app-functional-map.v4.json","waves/workflow-refactor-v5/spec.md"],"to_ref":"FUNC-ANALYSIS-RESULT"},{"active":true,"condition_refs":[],"from_ref":"REQ-ANALYSIS-RESULT","kind":"defines","ref":"EDGE-REQ-ANALYSIS-RESULT-INTEGRATION","source_refs":["docs/app-functional-map.v4.json","waves/workflow-refactor-v5/spec.md"],"to_ref":"DIM-ANALYSIS-RESULT-INTEGRATION"},{"active":true,"condition_refs":[],"from_ref":"REQ-ANALYSIS-RESULT","kind":"defines","ref":"EDGE-REQ-ANALYSIS-RESULT-STATE","source_refs":["docs/app-functional-map.v4.json","waves/workflow-refactor-v5/spec.md"],"to_ref":"DIM-ANALYSIS-RESULT-STATE"},{"active":true,"condition_refs":[],"from_ref":"REQ-ANALYSIS-SCOPE","kind":"defines","ref":"EDGE-REQ-ANALYSIS-SCOPE-API","source_refs":["docs/app-functional-map.v4.json","waves/workflow-refactor-v5/spec.md"],"to_ref":"DIM-ANALYSIS-SCOPE-API"},{"active":true,"condition_refs":[],"from_ref":"REQ-ANALYSIS-SCOPE","kind":"defines","ref":"EDGE-REQ-ANALYSIS-SCOPE-BEHAVIOR","source_refs":["docs/app-functional-map.v4.json","waves/workflow-refactor-v5/spec.md"],"to_ref":"DIM-ANALYSIS-SCOPE-BEHAVIOR"},{"active":true,"condition_refs":[],"from_ref":"REQ-ANALYSIS-SCOPE","kind":"defines","ref":"EDGE-REQ-ANALYSIS-SCOPE-DATA","source_refs":["docs/app-functional-map.v4.json","waves/workflow-refactor-v5/spec.md"],"to_ref":"DIM-ANALYSIS-SCOPE-DATA"},{"active":true,"condition_refs":[],"from_ref":"REQ-ANALYSIS-SCOPE","kind":"defines","ref":"EDGE-REQ-ANALYSIS-SCOPE-DEPENDENCY","source_refs":["docs/app-functional-map.v4.json","waves/workflow-refactor-v5/spec.md"],"to_ref":"DIM-ANALYSIS-SCOPE-DEPENDENCY"},{"active":true,"condition_refs":[],"from_ref":"REQ-ANALYSIS-SCOPE","kind":"defines","ref":"EDGE-REQ-ANALYSIS-SCOPE-ERROR","source_refs":["docs/app-functional-map.v4.json","waves/workflow-refactor-v5/spec.md"],"to_ref":"DIM-ANALYSIS-SCOPE-ERROR"},{"active":true,"condition_refs":[],"from_ref":"REQ-ANALYSIS-SCOPE","kind":"decomposes_to","ref":"EDGE-REQ-ANALYSIS-SCOPE-FUNC-ANALYSIS-SCOPE","source_refs":["docs/app-functional-map.v4.json","waves/workflow-refactor-v5/spec.md"],"to_ref":"FUNC-ANALYSIS-SCOPE"},{"active":true,"condition_refs":[],"from_ref":"REQ-ANALYSIS-SCOPE","kind":"defines","ref":"EDGE-REQ-ANALYSIS-SCOPE-INTEGRATION","source_refs":["docs/app-functional-map.v4.json","waves/workflow-refactor-v5/spec.md"],"to_ref":"DIM-ANALYSIS-SCOPE-INTEGRATION"},{"active":true,"condition_refs":[],"from_ref":"REQ-ANALYSIS-SCOPE","kind":"defines","ref":"EDGE-REQ-ANALYSIS-SCOPE-STATE","source_refs":["docs/app-functional-map.v4.json","waves/workflow-refactor-v5/spec.md"],"to_ref":"DIM-ANALYSIS-SCOPE-STATE"},{"active":true,"condition_refs":[],"from_ref":"REQ-AUDITED-SEMANTICS","kind":"defines","ref":"EDGE-REQ-AUDITED-SEMANTICS-API","source_refs":["docs/app-functional-map.v4.json","waves/workflow-refactor-v5/spec.md"],"to_ref":"DIM-AUDITED-SEMANTICS-API"},{"active":true,"condition_refs":[],"from_ref":"REQ-AUDITED-SEMANTICS","kind":"defines","ref":"EDGE-REQ-AUDITED-SEMANTICS-BEHAVIOR","source_refs":["docs/app-functional-map.v4.json","waves/workflow-refactor-v5/spec.md"],"to_ref":"DIM-AUDITED-SEMANTICS-BEHAVIOR"},{"active":true,"condition_refs":[],"from_ref":"REQ-AUDITED-SEMANTICS","kind":"defines","ref":"EDGE-REQ-AUDITED-SEMANTICS-DATA","source_refs":["docs/app-functional-map.v4.json","waves/workflow-